{"$schema":"http://json-schema.org/draft-07/schema#","$id":"https://schemas.ceragon.ai/ai-security/detector-catalog-v1.schema.json","type":"object","additionalProperties":false,"required":["format","formatVersion","catalogVersion","productionWriterEnabled","classes"],"properties":{"format":{"const":"ceragon.ai-security.detector-catalog"},"formatVersion":{"const":1},"catalogVersion":{"type":"string","pattern":"^[a-z0-9][a-z0-9._:-]{0,127}$"},"productionWriterEnabled":{"const":false},"classes":{"type":"array","minItems":1,"items":{"type":"object","additionalProperties":false,"required":["classId","credentialRole","representations","validators","transforms","limitations","defaultAction"],"properties":{"classId":{"type":"string","pattern":"^[a-z0-9][a-z0-9._:-]{0,127}$"},"credentialRole":{"enum":["STANDALONE_BEARER","SECRET_COMPONENT","IDENTIFIER_COMPONENT","PRIVATE_KEY","CAPABILITY_URL","NONCREDENTIAL_SENSITIVE","UNKNOWN"]},"representations":{"type":"array","minItems":1,"items":{"type":"string"}},"validators":{"type":"array","items":{"type":"string"}},"transforms":{"type":"array","items":{"type":"string"}},"limitations":{"type":"array","items":{"type":"string"}},"defaultAction":{"enum":["BLOCK","REDACT","WARN","ALLOW","DEGRADED"]}}}}}}
