{"format":"ceragon.ai-security.detector-catalog","formatVersion":1,"catalogVersion":"detector-catalog-v1","productionWriterEnabled":false,"classes":[{"classId":"aws-access-key","credentialRole":"STANDALONE_BEARER","representations":["plain-text","json-string","base64-wrapped"],"validators":["aws-access-key-shape"],"transforms":["secret.mask.minimum-unit"],"limitations":["issuer-liveness-not-checked"],"defaultAction":"REDACT"},{"classId":"openai-key","credentialRole":"STANDALONE_BEARER","representations":["plain-text","json-string"],"validators":["openai-key-shape"],"transforms":["secret.mask.minimum-unit"],"limitations":["issuer-liveness-not-checked"],"defaultAction":"REDACT"},{"classId":"private-key","credentialRole":"PRIVATE_KEY","representations":["pem","json-string"],"validators":["pem-private-key-parse"],"transforms":["secret.mask.minimum-unit"],"limitations":["encrypted-key-degraded"],"defaultAction":"BLOCK"},{"classId":"db-connection-string","credentialRole":"NONCREDENTIAL_SENSITIVE","representations":["plain-text"],"validators":["connection-string-shape"],"transforms":[],"limitations":["context-required"],"defaultAction":"WARN"},{"classId":"base64-wrapped-secret","credentialRole":"UNKNOWN","representations":["base64-wrapped"],"validators":["base64-decode-bounded"],"transforms":[],"limitations":["heuristic-only"],"defaultAction":"DEGRADED"}]}
